{
  "id": "tao",
  "type": "Feature",
  "conformsTo": [
    "https://www.opengis.net/spec/ogcapi-records-1/1.0/req/record-core"
  ],
  "properties": {
    "created": "2024-05-17T00:00:00Z",
    "updated": "2024-05-17T00:00:00Z",
    "type": "ogc_backend",
    "title": "Tool Augmentation by user enhancements and Orchestration (TAO)",
    "description": "",
    "keywords": [],
    "language": {
      "code": "en-US",
      "name": "English (United States)"
    },
    "languages": [
      {
        "code": "en-US",
        "name": "English (United States)"
      }
    ],
    "contacts": [
      {
        "name": "Platform team",
        "organization": "Tool Augmentation by user enhancements and Orchestration (TAO) by CS GROUP - ROMANIA",
        "position": "Customer Relations",
        "roles": [
          "user on-boarding",
          "platform operations",
          "stakeholder engagement"
        ],
        "links": [
          {
            "href": "https://tao.c-s.ro",
            "title": "Tool Augmentation by user enhancements and Orchestration (TAO)",
            "rel": "about",
            "type": "text/html"
          }
        ],
        "contactInstructions": "For inquiries on selecting Processing Services from the TAO Portfolio, and on budgeting the processing costs for your study areas, please email the Platform team at CS GROUP - ROMANIA",
        "email": "cs.ro.eosupport@soprasteria.com"
      }
    ],
    "themes": [],
    "license": "other"
  },
  "linkTemplates": [],
  "links": [
    {
      "rel": "website",
      "type": "text/html",
      "title": "Tool Augmentation by user enhancements and Orchestration (TAO)",
      "href": "https://tao.c-s.ro"
    },
    {
      "rel": "logo-dark",
      "type": "image/png",
      "title": "TAO Logo",
      "href": "https://tao.c-s.ro/wp-content/uploads/apple-touch-icon-152x152-1.png"
    },
    {
      "rel": "logo-light",
      "type": "image/png",
      "title": "TAO Logo",
      "href": "https://tao.c-s.ro/wp-content/uploads/tao-logo-white.png"
    }
  ]
}
